judul_lagu;nama_artis;playlist_name;url;genre_lagu;lyrics
Rangkum;Polka Wars;Indie Rock Indonesia;4j9AWlGmYrQwjxvmObIzXm;['indonesian indie'];Tersingkap bila Menatap cah'ya Di dalam bahaya terjamah  Bersila diam Menuju terang Deras bulir meresapi lara  Malam musim semi Raja alam rasa Berakhir di sana Kata rangkumkan udara ...
Laki-Laki Pemalu;Efek Rumah Kaca;Indie Rock Indonesia;5WUdbehFIiTDyw1vFCljNz;['indonesian alternative rock', 'indonesian indie', 'indonesian indie rock'];Senja akan segera berlalu Seorang lelaki melintas menyimpan malu, huuu Menyusur langkah sang gadis yang mungil Tapak kakinya yang lelah menyisakan perih, hiii  Nanti malam 'kan ia jerat rembulan Disimpan dalam sunyi hingga esok hari Lelah berpura-pura, bersandiwara Esok pagi 'kan seperti hari ini ...
Masa-Masa;The Adams;Indie Rock Indonesia;3da9tjhBqR14I04nHHGnje;['indonesian alternative rock', 'indonesian indie', 'indonesian indie rock'];Kau selalu ada Untuk tertawa Tak pernah lupa Dan meskipun salah Ikuti saja Karena muda Jiwa remaja  Seiya sekata bersama-sama Seiya sekata hadapi duka Seiya sekata canda tawa Masa lalu dan sekarang 'Kan kita kenang di masa yang datang ...
Another Day;The SIGIT;Indie Rock Indonesia;06CTBs4mTFwJzlrmAvU6d0;['indonesian alternative rock', 'indonesian indie', 'indonesian rock'];These things are beautiful Don't think they're reachable Another day, another sunset Confession won't make it right All the things we do at night Another day, another mindset ...
Barat;Barasuara;Indie Rock Indonesia;52E1hEuxwAfJIUGOpYmwyV;['indonesian indie', 'indonesian indie rock'];Kami menuju barat Maut kian melambat Merah melesat (Melantakkan angkasa) Merah merona  Hey ya-ya Hey ya-ya ...
Menenggala;Mooner;Indie Rock Indonesia;12ljrhiUlBUW8xi8k7sWid;['indonesian indie', 'indonesian indie rock', 'indonesian psychedelia', 'indonesian stoner rock'];Lalalala, menenggala Demi gala, demi hala Lalalala, menenggala Demi sara, demi laba  Pulang disambut solang Tura bikin merayang Walau sudah berkanjang Rodi jadinya rawang  Jejabah usang Sudah jadi abu arang ...
Roda Gila;Kelompok Penerbang Roket;Indie Rock Indonesia;3V0yduUwPTwpNTDskCSPh2;['indonesian indie', 'indonesian indie rock', 'indonesian rock'];Kehidupan Di dunia Banyak cara terlupa Kita manusia yang punya akal pikiran  Jangan gentar Bernyali besar  Roda kencang melaju berani Melesat gila kejar cahaya ...
Mati Muda;Kelompok Penerbang Roket;Indie Rock Indonesia;3zMJiWwtg4LIXXSZ53uKAM;['indonesian indie', 'indonesian indie rock', 'indonesian rock'];Berseragam berlaga jagoan Mau jadi apa? Seperti tentara kau menyerang Dan akhirnya celaka  Mati muda ...
Fatamorgana;Polka Wars;Indie Rock Indonesia;15cki3Uuq7qYnEmilHyIHs;['indonesian indie'];Terbelah jalan, hampa tujuan Berdagang asa, reka citranya Halau cahaya Nyatanya semu, angan tersapu Alasan tak dapat belenggu Hina adanya  Ayat amunisi Jaja ilusi  Berjanji, hindari Nyata tipu dayanya Fatamorgana! Fatamorgana! ...
Kau dan Aku Menuju Ruang Hampa;Efek Rumah Kaca;Indie Rock Indonesia;0H3I8PJh0mbJ5tSRleYywg;['indonesian alternative rock', 'indonesian indie', 'indonesian indie rock'];Akan ke manakah aku dibawanya? Hingga saat ini menimbulkan tanya Engkau dan aku menuju ruang hampa Tak ada sesiapa hanya kita berdua  Kau belah dadaku mengganti isinya Dihisap pikiranku memori terhapus Terkunci mulutku menjeritkan pahit  Engkau dan aku menuju ruang hampa Tak ada sesiapa hanya kita berdua  Kau belah dadaku mengganti isinya ...
Cinta Melulu;Efek Rumah Kaca;Indie Rock Indonesia;1jwaf6CWAWUrbqAT5mrKrA;['indonesian alternative rock', 'indonesian indie', 'indonesian indie rock'];Nada-nada yang minor Lagu perselingkuhan Atas nama pasar semuanya begitu klise  Elegi patah hati Ode pengusir rindu Atas nama pasar semuanya begitu banal  Oh-oh Lagu cinta melulu ...
Just;The Adams;Indie Rock Indonesia;02jNAnlofnyylX3k8ijYCB;['indonesian alternative rock', 'indonesian indie', 'indonesian indie rock'];once.i feel empty, you show your face to me once.i feel thirsty, but you alwasy be there for me don't care what people say. i just gonna do my way ...
Badai;Bangkutaman;Indie Rock Indonesia;6n1qZ0NjagTsByL2hzWFj9;['indonesian folk', 'indonesian indie', 'yogyakarta indie'];Desir-desir angin yang dingin Menghantarkan bait kesunyian Di ujung sore berkabut Menghembuskan melodi yang sendu  Oh, kabut malam, samar-samarkan bayanganmu Bersama kilat gemuruh, mari lagukan sisa waktu ...
Bekerja;Jirapah;Indie Rock Indonesia;6ty0s6bs6lnzC7e1Of2ec6;['indonesian indie', 'indonesian indie rock', 'indonesian shoegaze'];Terasa muda Sesaat Ada rasa yang tertunda Selalu Ku menunggu Selamanya Menuai dalam saatnya  Tak pernah berhenti Yang pasti Tidur di saat terjaga Bahagia Ku menunggu Selamanya Menuai dalam saatnya  Mengejar ...
Sloth;Monkey to Millionaire;Indie Rock Indonesia;4JL1gr2HN41wIc2oWe9tjh;['indonesian indie'];One of these days, she'll hate me even more The truth is I've never seen an open door So how could I come back? Nah just wanna come back  There were times, when there's only nice things to say Times how love keep cracked up my head When I still try to stand (stein), and I still here to stay  Rational have been gone away for so long Logic tries to following behind all along And they never come back And they never come back  Cause what's mine... has never felt as one of my own When you came along when you came along Cause what's mine... has never felt as one of my own When you came along when you came along  When the truth is always asking me to opened your heart Breaking denials and make it apart ...
Kaca;Anomalyst;Indie Rock Indonesia;5FF5770PyTMzygAAetVzss;['indonesian indie rock'];Roda yang terus berputar Melingkar dan berjalan Tak sekalipun berhenti Untuk menghela nafas  Lelah di gegap gempita Tersesak dalam ruang Semua yang disekitarnya Terus membakar raga ...
Merah;Efek Rumah Kaca;Indie Rock Indonesia;1gapJiMx5ZOmFB0mNdIhSQ;['indonesian alternative rock', 'indonesian indie', 'indonesian indie rock'];Dan kita arak mereka, bandit jadi panglima Politik terlalu amis, dan kita teramat necis Slalu angkat mereka, sampah jadi pemuka Politik terlalu najis, dan kita teramat miris  Dan kita dorong mereka, badut jadi kepala Politik terlalu kaotis, dan kita teramat praktis Slalu dukung mereka, cendikia jadi pertapa Politik terlalu iblis, dan kita teramat manis  Aku akan menjadi garam di lautan mereka Aku akan menjadi kanker dalam tubuh mereka Aaahhh... Aaahhh...  Sampai kapan kau biarkan, ia tak berdaya Ditelantarkan harapan, ia kesakitan Berurai berantakan, tak karuan Lara dimana-mana  ...
20's;Mond;Indie Rock Indonesia;6FXwGkCBw2TcUeSciRQ4H6;['indonesian neo-psychedelia'];Crazy as it seems Crazy as you and me  We're living in our twenties I can't handle things alone  We cut ties to loosen up We put ties to build up  Thought he was a child With just a few problems Something green can hide For a while Thought he was a child With just a few problems Something green can hide ...
Is It The Answer;Reality Club;Indie Rock Indonesia;5dFLCZFECZMRYICtN31BMg;['indonesian indie'];I make you break You move I take Love is the answer so they say But if I went away What would you say Would it be enough to make you stay As you look to the exit I don't even know why I'd do this anymore I know there's things I should know  And I know you can't accept She's the love that I kept Scared I'll push you away ...
Thrills;Grrrl Gang;Indie Rock Indonesia;1ZJaJPoS4gDiEJetz3glPt;['indonesian indie', 'indonesian indie rock', 'yogyakarta indie'];"It was a hot summer night when we first met I was only seventeen Your name was Robin And that's all I know  I was dancing on my own in the middle of the room When I turned around and you caught my eye There was nothing else that I could really do But one thing for sure is that I wouldn't be alone  You took me to your room And you said that I was yours I called you, ""Daddy"" With your arms wrapped around my neck  ..."
Dream Grrrl;Grrrl Gang;Indie Rock Indonesia;3QUBrTX4mD1yPud2xOFRyP;['indonesian indie', 'indonesian indie rock', 'yogyakarta indie'];She, she's got a mean look Giving you death glares But she can be your dream girl She can be your dream girl  She, she's got a mean streak Losing her head at the wrong times She can be your dream girl She can be your dream girl  She's a vision of heaven and hell Let her be your dream girl She can mesmerize you with one glance Let her be your dream girl Let her be your dream girl (Dream girl) Let her be your dream girl (Dream girl)  She, she's got a mean look ...
Sintas;Tashoora;Indie Rock Indonesia;7sz6kwFjYT0asnQGei64vw;['indonesian indie'];Sempat waktu berhenti melangkah Buta mataku dan hilang arah Sirna harapku pada manusia  Dingin bergulir, mendekap getir Kembali lahir, kembali lahir  Dingin bergulir, mendekap getir Belum berakhir, belum berakhir  Lawan pandang-pandang yang merendahkan Bisikan suara yang menjatuhkan Kita harus saling menguatkan Sudahi sepi dalam perjalanan Buka satu dua lagi lembaran Kita harus saling menguat  Sebagian menaruh harapan ...
Siapa Kamu?;Zirah;Indie Rock Indonesia;6daxTVyF7Yz5fcJPeEX98h;['indonesian indie rock'];Oh, ini jiwa ingin dicari Oh, ini jiwa taratatara  Apa yang kau lakukan? Apa yang kau berikan? Apa yang kau dapatkan? Tahukah kamu?  Apa yang kau rasakan? Apa yang kau harapkan? Apa yang kau katakan? Tahukah kamu?  Oh, ini jiwa ingin dicari Oh, ini jiwa taratatara  Apa yang kau tinggikan? Apa yang kau rendahkan? Apa yang kau tengahkan? ...
The Youth;SCALLER;Indie Rock Indonesia;0ikZncbyX0HQFUn77v6xJ7;['indonesian indie'];My world is dying Before my very eyes Familiar faces Oh, so far gone  Bury all the pain that I can't stand See if someone care My world is dying  Everyone, I tell you what There's no surprises, my world is spinning For everyone, I've had enough ...
Prayer of Tempest;Sigmun;Indie Rock Indonesia;014fyvmAi94F1NUXNKiARZ;['indie psychedelic rock', 'indonesian indie', 'indonesian neo-psychedelia', 'indonesian rock'];See the color of the rain overwhelms your cover Gentle giant laid to rest as the night surrendered Tiny whistles of the trees they tried to tell me something Darkest shades of the leaves tell me what you're hiding  And all the things that we've built shan't be brought along And all the things that we've lost shall be turned to songs ...
Mirage;Chewing Sparkle;Indie Rock Indonesia;6bIQDMlSJpws1xL8eXUerk;['indonesian indie rock'];I sure I saw you on the highway Hand on the phone and picked up the line It keeps the morning in a heart wave I guess my body won't be enough to  Wake up another Day without thinking about it Fake laught tomorrow  Where are you going tonight? Will it be bitter to myself? Where are you going tonight?  Where are you going tonight? Will it be bitter to myself? Where are you going tonight?  She said i'm living in the hideway Two stars away from meeting your signs ...
Paintings/Pantings;Sajama Cut;Indie Rock Indonesia;1NwKzipXQdwRCSHmUGy25Q;['indonesian indie'];Rah! Yeah the sun it'll always shine And this picture of your behind You'll be mine for the hundredth and millionth time Again Pipe down a little Cut down the wall Tusk and a fiddle Cuss pounds to pore Fight means belittled Caisson (on) a horse I never cared Ripe are the liver Paint all the wall Bite down the little devil ...
The Sentiment;SMSR;Indie Rock Indonesia;4O5yuoPYHs1oU8ioYQTT6p;['indonesian neo-psychedelia'];When I was an infant kid They have been nurturing me Till this day and the through But past mistakes are gone The unconditioned love them to you ...
What They Do In The Summer;The Cat Police;Indie Rock Indonesia;5hk7uLXSKbNhQraDwXIhfq;['indonesian indie', 'indonesian indie rock'];Writers bring their pens to the coffee shop Telling all oh the unnecessary things Makes their coffee sweeter May the joy be with her  What they do in the summer? I only can guess, such a fun thing What happen to the lovers? They must be loving, take care of each other  She's staring at the window Reflecting her shadow Then what else you can do in this summertime? We're just making ripple We're just making ripple  What they do in the summer? I only can guess, such a fun thing What happen to the lovers? They must be loving, take care of each other  ...
Selancar;Erratic Moody;Indie Rock Indonesia;1paPwlZcB4QSKtIeDaymHR;['indonesian indie rock'];Lari di pantai, pantai di Kuta Kupanggil teman-temanku di hari itu Siap berlayar bersama paman nelayan Ku ambil selancar ke atas sana, aw ...
Lagu Lama;FLEUR!;Indie Rock Indonesia;1aPzi6BINcQAhxtVHzWixK;['indonesian indie'];Saat semua pada tempatnya Lagi-lagi kau datang bawa cerita lama Logika tak bernyawa  Hadirmu mengganggu tenangku Habis sabar ku dengar Tak ada ujungnya Janji 'tuk berbeda  Kapankah engkau sadar ku tahu semua hanya basa basi Akhirnya selalu beradu akal dengan tempramen tinggi Lagu lama! ...
Waiting For You;Indische Party;Indie Rock Indonesia;1JPCdPcrQsYsAspPa7vOvN;['indonesian indie'];if you want me why don't you call me if you miss me why wont you say if you want me why dont you just say to me i will be waiting, always be waiting for you always be waiting ... if you want me why don't you call me pride will only gonna hurt yourself ...
Tipu Daya;The Panturas;Indie Rock Indonesia;4kJD28mifEaBrPXXHZ3re7;['indonesian indie'];Satu jengkal belati Siap mencabik nadi Pecundang di perantauan Gelar dia hari ini  Dirundung kenyataan Fakta yang mencengangkan Rusak perangai yang dia ciptakan Boyak sudah, citra berantakan  Melayang, bak camar menembus awan Bayangkan sanjungan harum semerbak mawar  ...
Di Padang Lumpuh;.Feast;Indie Rock Indonesia;0u7Y9O9zcLRsmjK9idr83c;['indonesian indie'];"Siapa siap meninggal? Siapa siap ditinggal? Siapa tahu harga perubahan tapi tak siap bertemu ajal? Kita banggakan yang dulu saja Bakar ban, tutup jalan, lempar segala Bicara dengan megafon sampai berbusa Anti-kritik hampir sama dengan Istana  Nama demi nama jadi senjata Tiap kali ditanya ""Kau tahu apa?"" Berdiri di atas pendapat orang mati Tak bisa berlari dengan mulut sendiri  Hiduplah tanahku, negeriku, rumahku Bangsa para korban Gala raya bumi digdaya ..."
Dalam Hitungan;.Feast;Indie Rock Indonesia;58ourzCt3VFuymu022tK38;['indonesian indie'];"Aku tak berguna jika tak diukur angka Bertobat di media, Tuhan pasti salah sangka Mimpi butuh dana, ""Engagement rate-mu berapa?"" Terka jarak berita, tragedi milik siapa?  Memahat citra sesuai standar-Nya Surga buka cabang, kita semua pialang Seratus ribu per sepuluh Giga(byte) Akhirat yang adil, semua orang berwenang  Sekarang semua Tidur tenang Cek lagi besok pagi Keselamatan  Kita membangun bersama Tuhan yang baru Dunia yang berani ..."
Pancarona;Barasuara;Indie Rock Indonesia;49XXrWxrmBU34mNMpxsSfG;['indonesian indie', 'indonesian indie rock'];Melarutkan anganku Hati yang meninggalkanmu Membiru, membisu Mereka lambat laun  Kan merasa tak kuasa Menahan geram batinmu Angkasa, samudra Terhampar jawaban  Kau mulai meragu akan isi hatimu ...
Atom;Glaskaca;Indie Rock Indonesia;32tz3G0WzWEm2bUbW6pgyw;['indonesian indie rock'];Turunkan pandangan Merenungi jejak yang sempat megah Terpahat di atas pasir Tetap tersapu ombak berdesir  Tak sempat terbayangkan Pusat pusaran adalah khayalan Semua yang terekam hilang temaram ...
Hagia;Barasuara;Indie Rock Indonesia;1xdvyDZZLVzDwLDU85ePBn;['indonesian indie', 'indonesian indie rock'];Sempurna yang kau puja Dan ayat-ayat yang kau baca Tak kurasa berbeda Kita bebas untuk percaya  Sempurna yang kau puja Dan ayat-ayat yang kau baca Tak kurasa berbeda Kita bebas untuk percaya  Sempurna yang kau puja ...
Sendu Melagu;Barasuara;Indie Rock Indonesia;0mD2oRksOCjlfqr3snU96p;['indonesian indie', 'indonesian indie rock'];Semua yang kaurindu Semua menjadi abu Langkahmu tak berkawan Kau t'lah sia-siakan  Waktu yang kautahu Waktu yang berlalu Ingatmu kau merayu Ingatnya kau berlalu  Sendu melagu Sendu melagu Sendu melagu  ...
Reaktan;Zat Kimia;Indie Rock Indonesia;6rCFDbq5RdQvg8qrIj1LH3;['bali indie', 'indonesian indie', 'indonesian indie rock'];Di semesta (Di semesta) Ada kita (Ada kita) Manusia (Manusia) Bagian darinya Selalu bereaksi Bersama dia  Semesta 'kan mencari Cara 'tuk wujudkan Buah vibrasimu Semesta bereaksi Bersamamu  Beri dia Yang terbaikmu Karena dia ...
Twenty Something;The Schuberts;Indie Rock Indonesia;70D2DDWYoD1gTpO2WfRStJ;['indonesian indie rock'];"Bodies of the world of polyphonic Scared by the holy matrimony We're in a verge of something Smashed young and, twenty something  Foul-mouths and crystal hearts all around Loud cheer and awkward eyes, saying that ""Careful, make no mistakes, babe"" ..."
Telenovia;Reality Club;Indie Rock Indonesia;0HA0Z2c9zzDB5WrpngtqxY;['indonesian indie'];All along the west, we look to the east The answer's there in silhouettes But silver's all above our heads  All along we were addicted To the kind of shapes our pain afflicted Wresting till the monochrome moonlight It's a shade that we will never be  I know I'm wasting time by leaving you behind I know Couple weeks ago you were so vivid in my mind  And when I wake up tomorrow, will I see another dawn? As the days turns so hollow, ...
Belalang Sembah;.Feast;Indie Rock Indonesia;73aE2L4Y6Jt76GW1HXnAvR;['indonesian indie'];Kusimpan tubuhmu Dalam kantong kiriku Setiap saat kulit ini hendak begesekan Keringat bertemu saat jari ke kanan Tak percaya semua yang kulihat dari layar, hmhmm Kecuali apa yang keluar dari milikmu Yang hakiki hanya tokoh profil lekukmu  Namun sabun kita berlumuran Dan tubuhmu dibalut hal berbeda tiap malam Saat ini ku masih figuran muram  Tapi jadikanku Belalang sembah ...
Timur Jakarta;Purpla;Indie Rock Indonesia;5jbEHi5ZEFi2Jba1r1jLJG;['indonesian indie rock'];Sore ini ku mengarungi hari Melintasi debu-debu pembangunan Terbesit hari-hariku di timur Jakarta yang takkan bisa terlupa  Semua terasa tak jauh berbeda Kalimalang setia dengan warnanya Berdamping dengan para pengendara Nostalgia pun bawa ku lebih dalam  Oooh, di timur Jakarta aku dan kawan-kawan ku beranjak dewasa Oooh, di timur Jakarta ku belajar bersama tuk mengarungi dunia ...
Sandiwara;Midnight Fusic;Indie Rock Indonesia;6P303Kjk0CWRtDU2ZjBzar;['malaysian indie'];Bercanda Tiada habis, bertukar jiwa Tertawa Hingga pagi, tenangkan resah Tak perlu  Bersedih Kali ini kita 'kan kenang Cerita Hari ini 'tuk masa datang Tak perlu  Sendiri, gulana Menangis, merana  Dan bila ...
Tafsir Mistik;The Panturas;Indie Rock Indonesia;0aPepMh9otBMbV4xKmiRtq;['indonesian indie'];Wahai setan yang bersembunyi di antara makna Dan tak mempan diusir dengan ruqyah Merasuki bangunan kepala Dan mengendap hingga jadi lumrah  Ruang khayal yang telah kau buka Beri pembenaran pada dosa-dosa Manusia yang takabur neraka Dan coba ciptakan swanirwana  ...
Pulang, Kembali;L'Alphalpha;Indie Rock Indonesia;3ZqDDAJ5XKh3gkwLE6Q4XS;['indonesian folk', 'indonesian indie'];Setelah sekian lama Kukejar mimpi yang sederhana Hari-hari yang t'lah kulalui Hadapi rintang yang tak sederhana  Dalam lelah aku teringat Akan waktu yang kurindukan Tempatku pulang dan kulabuhkan Segala gundah yang kurasakan  Dan ketika sudah tiba waktuku Menuju pulang Kunantikan setiap senyum wajahmu ...
Konservatif;The Adams;Indie Rock Indonesia;7qUkZhXym0LCTdcmwhGO3b;['indonesian alternative rock', 'indonesian indie', 'indonesian indie rock'];Siang kusaksikan engkau terduduk sendiri Dengan kostummu yang berkilau Dan angin sedang kencang-kencang berhembus Di Jakarta  Dan aku 'kan berada di teras rumahmu Saat air engkau suguhkan ...
Yang Patah Tumbuh, Yang Hilang Berganti;Banda Neira;FOLK /INDIE INDONESIA;6Rd4ep779v8CjlFVhaHrNX;['indonesian folk pop', 'indonesian indie', 'indonesian pop'];Jatuh dan tersungkur di tanah aku Berselimut debu sekujur tubuhku Panas dan menyengat Rebah dan berkarat  Yang... Yang patah tumbuh, yang hilang berganti Yang hancur lebur akan terobati Yang sia-sia akan jadi makna Yang terus berulang suatu saat henti Yang pernah jatuh 'kan berdiri lagi Yang patah tumbuh, yang hilang berganti  ...
Lara;Dialog Senja;FOLK /INDIE INDONESIA;46JZfTdDzyiMlMZKqku2Qn;['indonesian folk', 'indonesian indie'];Ketika senja datang Ku merasa setengah diriku menghilang Bagaikan tak berdosa Kau hancurkan rasa yang selama ini kutanam  Saat semuanya telah pergi Bayangmu kembali mengisi Entah apa yang kau mau Ku tak berhak lagi 'tuk mengungkit kembali  Menghapus tinta yang pernah kau lukis di kanvas hatiku Merobek semua bayangan yang tampak di relung sukmaku ...
Bekas Luka;Dialog Senja;FOLK /INDIE INDONESIA;0gQYTx2gb8fUHr9rPwBWSV;['indonesian folk', 'indonesian indie'];Semua kelaraan ini terus berlanjut Musim pun telah berganti Karang pun terkikis menjadi pasir Aku tahu semua telah terjadi Kefanaan ini membuatku lemah tak bernyali  Lantunan nada Merasuk sukma Fana membawa Luka lama  Lupakan indah Hilangkan semua Semesta pun rela Menerima  Seperti malam Heningkan ramainya dunia ...
Heart In a Cup;Garamerica;FOLK /INDIE INDONESIA;4vWCcSVze8kpmrdUJvr7xQ;['indonesian folk', 'indonesian indie'];You will not know what I'm fighting for You will not see feel what I'm searching for 'cause your eyes are the air runs through my lungs  I will not know what you want from me We both won't hold fate to the same road 'cause your eyes are the air runs throgh my lungs ...
Sebagai Kawan (Menampilkan Jeremia Kimosabe);Banda Neira;FOLK /INDIE INDONESIA;5zprFhlIfAoOJZ8MzYqO8v;['indonesian folk pop', 'indonesian indie', 'indonesian pop'];Jangan berdiri di depanku Karena 'ku bukan pengikut yang baik Jangan berdiri di belakangku Karena 'ku bukan pemimpin yang baik Berdirilah di sampingku Sebagai kawan Kawan Kawan  Kawan Kawan ...
Esok Pasti Jumpa (Kau Keluhkan);Banda Neira;FOLK /INDIE INDONESIA;6tGbCGNv2jxMSqfQ7pxo17;['indonesian folk pop', 'indonesian indie', 'indonesian pop'];Du-du-du-du-du-du-du-wei, wei  Kau keluhkan awan hitam Yang menggulung, tiada surutnya Kau keluhkan dingin malam Yang menusuk hingga ke tulang  Hawa ini kau benci Dan kau inginkan 'tuk segera pergi Berdiri angkat kaki Tiada raut riangmu di muka Pergi segera  Hu, hu, hu-uh Hu, hu, hu-uh Hu, hu, hu-uh Hu, hu ...
Malam Jatuh Di Surabaya;Silampukau;FOLK /INDIE INDONESIA;6OAz55LXyPBdZhaxE761Mi;['indonesian folk', 'indonesian indie', 'surabaya indie'];Gelanggang ganas 5:15 Di Ahmad Yani yang beringas Sinar kuning merkuri Pendar celaka akhir hari Malam jatuh di Surabaya ...
Sampai Jadi Debu (Menampilkan Gardika Gigih);Banda Neira;FOLK /INDIE INDONESIA;0ROj512WvJ1eqeELd7MEdJ;['indonesian folk pop', 'indonesian indie', 'indonesian pop'];Badai Tuan telah berlalu Salahkah ku menuntut mesra? Tiap pagi menjelang Kau di sampingku Ku aman ada bersamamu  Selamanya Sampai kita tua ...
Senja di Jakarta;Banda Neira;FOLK /INDIE INDONESIA;7jZsrQkxnhsnPRlgWiQxLH;['indonesian folk pop', 'indonesian indie', 'indonesian pop'];Bersepeda di kala senja Mengejar mentari tenggelam Hangat jingga temani rasa Nikmati Jakarta  Bersepeda keliling kota Kanan kiri, ramai jalanan Arungi lautan kendaraan uwo oh Maafkan Jakarta Parapa, parapa, parapa, parara ...
Sementara (Live);Float;FOLK /INDIE INDONESIA;4RWsdx5N1JpprNlovU7dOL;['indonesian folk', 'indonesian indie'];Sementara Teduhlah hatiku Tidak lagi jauh Belum saatnya kau jatuh  Sementara Ingat lagi mimpi Juga janji-janji Jangan kau ingkari lagi  Percayalah hati Lebih dari ini Pernah kita lalui Jangan henti disini  Sementara Lupakanlah rindu ...
Bersenjagurau;Senar Senja;FOLK /INDIE INDONESIA;3FyODfVAL5huAUqd7FhlTP;['indonesian folk', 'indonesian indie'];Uh-uh-uh, uh-uh-uh Ah-ah-ah  Langit senja, bawa aku Bermain bersama di hari yang cerah Kicau burung, bernyanyilah Temani hangatnya, senyuman indahnya  Lupakan gundahmu ...
Dialog Hujan;Senar Senja;FOLK /INDIE INDONESIA;6ZjfVru61QLpKl0gQ8JSmT;['indonesian folk', 'indonesian indie'];Bicara rindu Bicara haru Luangkan ruang imajimu  Bernyanyi merdu Bernyanyi sendu Bebaskan birunya hatimu ...
Semoga, Ya;Nosstress;FOLK /INDIE INDONESIA;6wHnwqvtNdQicSPTTkYRQN;['indonesian folk', 'indonesian folk pop', 'indonesian indie'];Semoga, ya, hari ini Lebih baik dari hari kemarin Yang lewat begitu saja Tanpa lakukan apa-apa  Semoga, ya, pagi ini Lebih cerah dari pagi kemarin Mungkin bisa bangun lebih dini 'Tuk bergegas siapkan diri  ...
Mewangi;Banda Neira;FOLK /INDIE INDONESIA;0w6iO73gRXnjA4xhxOED4H;['indonesian folk pop', 'indonesian indie', 'indonesian pop'];Riuh rasa diembannya Melewati hari Menyeruak Mengumbar wewangi ...
Pegang Tanganku;Nosstress;FOLK /INDIE INDONESIA;6xHRfpo0kMRNuZ3v1e3xYF;['indonesian folk', 'indonesian folk pop', 'indonesian indie'];Pegang tanganku Hentikan tawamu sejenak Sudah terlalu banyak 'tuk senang Sudah saatnya merenung dan bersyukur  Oh, indahnya menjalani denganmu Oh, nikmatnya bersamamu Tapi kita harus mulai mengerti Tapi kita harus mulai batasi Kar'na, kar'na, kar'na  Indah itu tak selalu ada Senang itu sementara Jika senang, jangan terlalu Jika sedih, jangan terlalu  ...
Pulang;Float;FOLK /INDIE INDONESIA;5Ge3e6dV4wsae8lDQQq8PY;['indonesian folk', 'indonesian indie'];Dan lalu Rasa itu tak mungkin lagi kini Tersimpan di hati Bawa aku pulang, rindu Bersamamu  Dan lalu Air mata tak mungkin lagi kini Bicara tentang rasa Bawa aku pulang, rindu Segera ...
Puan Kelana;Silampukau;FOLK /INDIE INDONESIA;31VumPyqGjXeqYDQRy90y0;['indonesian folk', 'indonesian indie', 'surabaya indie'];Kau putar sekali lagi Champs-�lys�es Lidah kita bertaut � la Fran�aise Langit sungguh jingga itu sore Dan kau masih milikku  Kita tak pernah suka air mata Berangkatlah sendiri ke Djuanda Tiap kali langit meremang jingga Aku 'kan merindukanmu  Ah, kau puan kelana Mengapa musti ke sana? Jauh-jauh puan kembara Sedang dunia punya luka yang sama  ...
